sortOrder,slug,number,title,hover,category,context,resume,shift,synthesis,filters,imageFile
1,"futuro-proximo","01","Fazer o futuro parecer próximo.","Do insight à presença","Manifesto · Reposicionamento · Marca com propósito","Previdência institucional","O tema era técnico, distante e pouco desejável. A comunicação precisava sair da obrigação financeira e se aproximar da vida real.","De assunto frio para cuidado, autonomia e futuro possível.","Planejar não é deixar de viver. É criar condições para viver com mais liberdade.","Marcas com propósito,Estratégia de marca","project-2.jpg"
2,"identidade-sensacao","02","Dar identidade a uma sensação.","Ver processo","Identidade visual · Direção estética · Universo sensorial","Marca autoral","A marca precisava deixar de ser uma soma de referências bonitas e passar a ter atmosfera própria.","De estética bonita para universo visual reconhecível.","Uma identidade forte não apenas aparece. Ela cria clima.","Identidade visual,Direção criativa","project-1.jpg"
3,"estrutura-intuitivo","03","Dar estrutura ao que ainda estava intuitivo.","Do insight à presença","Posicionamento · Narrativa · Arquitetura de marca","Marcas autorais e especialistas","Algumas marcas têm boa ideia, bom produto e intenção real, mas comunicam de forma dispersa.","De ideias soltas para marca com direção.","Estruturar uma marca é fazer o valor aparecer sem precisar gritar.","Estratégia de marca","project-3.jpg"
4,"produto-imaginario","04","Transformar produto em imaginário.","Ver processo","Campanha · Direção criativa · Moda/lifestyle","Moda e comportamento","O produto precisava deixar de ser apenas mostrado e passar a ser desejado.","De produto isolado para universo de desejo.","Campanha é quando a marca encena o que quer representar.","Campanhas,Direção criativa","project-4.jpg"
5,"publico-estrategia","05","Traduzir público em estratégia.","Do insight à presença","Leitura de público · Relacionamento · Estratégia comercial","Operação comercial B2B","O desafio era lidar com públicos diferentes, níveis distintos de maturidade e necessidades práticas de confiança.","De atendimento operacional para relacionamento como estratégia de valor.","A venda começa quando a comunicação entende a pessoa antes de apresentar a solução.","Comunicação comercial,Estratégia de marca","project-5.jpg"
6,"presenca-permanece","06","Criar presença que permanece.","Ver processo","Evento · Ativação · Direção de arte · Experiência","Cultura jovem e experiência coletiva","O projeto precisava ser mais do que um evento. Precisava ter identidade, desejo, circulação e memória.","De evento pontual para experiência com memória.","Uma marca também vive nos vestígios que deixa.","Experiências,Direção criativa","project-6.jpg"
